{
  "format": "mathaudit-qualification-publication-manifest-v0.1",
  "tool_version": "0.2.0",
  "source_plan_sha256": "c246d426ca8b06e01546d9c3d276c29b1ae81de682bdf33cfaa7edb1573b1c18",
  "analysis_config_raw_sha256": "bacb9aa4cc0d28311829bc9b8ed20a206b19ca6aca6eaef25907bb4f2b15a549",
  "label_variants": [
    "deterministic"
  ],
  "analysis_inputs": [
    {
      "label_variant": "deterministic",
      "analysis_sha256": "58c50ea66e549767589857ec3839c977b95bf0fca33d67d72b4404e8d292256a",
      "raw_sha256": "bcbc7b21981273d0268f54e0811617ff4b4a026794ba349071dd74b8a853c904"
    }
  ],
  "command": "mathaudit qualification-publish --analysis ANALYSIS [--analysis ANALYSIS] --output-dir OUTPUT_DIR",
  "artifacts": [
    {
      "relative_path": "figures/availability.svg",
      "sha256": "523edfcacb96ad41559b6fe551d86f659c3ddcfd626f7e37ea55e3fe4c158083"
    },
    {
      "relative_path": "figures/availability.svg.manifest.json",
      "sha256": "507df7232e3dd806a8cea7f9e16339f659d3687d04980d1b86c5b91e237040c9"
    },
    {
      "relative_path": "figures/dependence.svg",
      "sha256": "87ec2285f4cbdbd624a6109aa63a7b5a9c2c91523d47f9e8ba0ca489a9788797"
    },
    {
      "relative_path": "figures/dependence.svg.manifest.json",
      "sha256": "1e6267c0e9e3f7764dee8f4bec0a3f4175203611f5e931b6f4e5688ab36e79bc"
    },
    {
      "relative_path": "figures/repair_harm.svg",
      "sha256": "592d7eff281c0f6fc5b41e1fff79d1c9e42ac26bea4d7aef8e492f27b7331d53"
    },
    {
      "relative_path": "figures/repair_harm.svg.manifest.json",
      "sha256": "031daba41be7b4ddb0ae0640020b61ce1cf638e4a9c9b1c5f9665b8ed38a1149"
    },
    {
      "relative_path": "figures/repetition.svg",
      "sha256": "e528ae84af3fa3fb33f372775314a79e27ffd21613c74b76132f206e6b61b71d"
    },
    {
      "relative_path": "figures/repetition.svg.manifest.json",
      "sha256": "623cb8e55b2e72ba5c541fe1f0dbf28ca3d1f4d3ceef5c4042a62e4e852417c7"
    },
    {
      "relative_path": "publication-data.json",
      "sha256": "2204a3a5f2eba19fdcac270e8f9f470d0eed4c6df3b981ec5951e69eeed8d19d"
    },
    {
      "relative_path": "tables/availability.csv",
      "sha256": "94b0ba183494b77ff1406797a81ae28611789c502d6bbcbacd1eaecedd527ac6"
    },
    {
      "relative_path": "tables/cofailure.csv",
      "sha256": "ff6a79f8136d89a2c558c552d7a5f2eccb3595ba4e08132fd4cb389fd85b9aa4"
    },
    {
      "relative_path": "tables/cost.csv",
      "sha256": "00714821e83dc3419ef6b3ce50360b0836fb4893d439e37216d86a1917f42f6e"
    },
    {
      "relative_path": "tables/effective_support.csv",
      "sha256": "ba64c8bcc52663dafd886db4495d419cb24f6bff07461c0da68da5258cec542b"
    },
    {
      "relative_path": "tables/exact_pairwise.csv",
      "sha256": "caad1b5b5c8b803ff832897df3f354c9355a041f0bd1a328be963cca2af8e282"
    },
    {
      "relative_path": "tables/final_outcomes.csv",
      "sha256": "deff68badeac895126afb995c2c280815bbe282b6c7a75b921effefc3c76a347"
    },
    {
      "relative_path": "tables/source_type_pairwise.csv",
      "sha256": "d56e5fa38bef35a054a22b50920f9c45656dc395bc2a5eb2053b859f2edcb9d3"
    },
    {
      "relative_path": "tables/text_repetition.csv",
      "sha256": "1b5d0fce5e888e5be961a917dec879355e1c1d92658df3d063799add98805cfc"
    },
    {
      "relative_path": "tables/transitions.csv",
      "sha256": "60ec8331974521467daaa454a99280def3fd9ebb234c23ae7ccfc1325a28cd87"
    },
    {
      "relative_path": "tables/utilization.csv",
      "sha256": "c7ac8915a44ff66298bbaf176be1b2eb987470d55c95d370f1a99a7bbb53600c"
    }
  ],
  "system_ranking_computed": false,
  "manifest_sha256": "a01da71bff4a8ada890803922a7eec98916761ecfaf6fbdfc611a651ce23499e"
}
